,time,username,fullname,tweet,retweets
132,May 31,@jimcramer,Progressive Caucus,"Congratulations to the @Boeing Flight line workers in South Carolina on joining the @MachinistsUnion 

#unionstrong",49
133,May 31,@Reuters,The Wall Street Journal,"Stocks sensitive to the trade tariffs, such as Boeing and Caterpillar, were among the Dow industrials’ biggest decliners ",
134,May 31,@USProgressives,Bloomberg,Boeing South Carolina workers vote to unionize in rare labor win https://bloom.bg/2J1FqPd ,42
135,May 27,@WSJ,TheStreet,"Sorry, @ElonMusk, @BoeingCEO says Boeing has it in the bag.....Who do you think wins the race to Mars -- $BA or SpaceX?  https://buff.ly/2stCOyp ",
136,May 27,@business,CNBC,The new Boeing 777 airliner will be able to retract part of its wings — a first for a commercial plane. https://cnb.cx/2KRUXxk ,
137,May 26,@TheStreet,The Seattle Times,Boeing's longest serving employee dies at 96. Diana Rhea witnessed 75 years of change with the airplane maker. https://st.news/2IT4J1P ,
138,May 26,@CNBC,Scott Bateman,"Such a beautiful story of personal commitment to a company that Diana loved and an employer that truly values the contribution of its employees. 75 years - one employer, a feat within itself. Rest in peace dear lady. #Boeing #seattle #aviation #avgeek",
139,May 26,@seattletimes,Dominic Gates,"Diana Rhea loved working and loved Boeing. She combined those loves for 75 years, starting in 1942 as a 20-year-old clerk-typist and retiring last year at 95. Ms. Rhea died Wednesday at 96 ",3
140,May 26,@jumbo747pilot,CBS News,"Meet the brave doctors and nurses, who ensure that 90% of American soldiers that are wounded in action ultimately survive. https://cbsn.ws/2GPyAGt  Presented by @Boeing ",17
141,May 25,@dominicgates,The Seattle Times,"In 1968, Rhea became Boeing’s first female manager in Manufacturing Engineering, supervising a team of up to 40 people. As for being a pioneer and a role model, her daughter says, “She just lived it and made it happen.” ",
142,May 25,@CBSNews,CBS This Morning,"Meet the brave doctors and nurses on the front lines, saving the lives of American troops without the aid of electricity or even running water https://cbsn.ws/2GPyAGt  Presented by @Boeing ",33
143,May 24,@seattletimes,Heather Gies,"Guatemala flights to Israel: US casino magnate Sheldon Adelson provided Guatemala's official delegation a Boeing 767 to travel to Israel for the relocation of its embassy from Tel Aviv to Jerusalem, a Guatemalan government official said Friday. ",
